{
  "contractId": "insight.model-manifest",
  "schemaVersion": "1.0.0",
  "scope": "INS-007",
  "runtimeOwner": "bn-manager",
  "admissionPolicy": {
    "requiredApprovalState": "approved",
    "allowedModelFormat": "xml-bif-0.3",
    "registryRequired": true,
    "missingSourceBehavior": "block-runtime-admission",
    "missingApprovalBehavior": "block-runtime-admission"
  },
  "derivativePolicy": {
    "registryCopies": "BN Manager may regenerate a registry copy only from its named BNs source after hash reconciliation, stable-ID uniqueness checks, structural and semantic validation, and recorded model-owner and clinical approval.",
    "legacyModuleCopies": "Retire after consumers use BN Manager REST; until removal they remain non-runtime and exact copies must retain the recorded source hash.",
    "orphanedCopies": "Quarantine and retire unless a clinical model owner identifies an approved source and admits the artifact through the registry.",
    "nonRegistryAssets": "All .net and non-registry XML artifacts are model-development inputs only and cannot be loaded at runtime."
  },
  "topics": [
    {"id": "continuing-medications", "path": "BNs/5 - Continuing Medications", "sourceStatus": "model-development-source", "canonicalOwner": "clinical-model-owner", "formats": ["xml", "net"], "approvalState": "unapproved", "allowedRuntimeUse": false},
    {"id": "continuing-same-medication", "path": "BNs/6 - Continuing the Same Medication", "sourceStatus": "model-development-source", "canonicalOwner": "clinical-model-owner", "formats": ["xml", "net"], "approvalState": "unapproved", "allowedRuntimeUse": false},
    {"id": "clozapine-treatment-resistant", "path": "BNs/7 - Clozapine in Treatment-Resistant Schizophrenia", "sourceStatus": "model-development-source", "canonicalOwner": "clinical-model-owner", "formats": ["xml", "net"], "approvalState": "unapproved", "allowedRuntimeUse": false},
    {"id": "clozapine-aggressive-behavior", "path": "BNs/9 - Clozapine in Aggressive Behavior _", "sourceStatus": "model-development-source", "canonicalOwner": "clinical-model-owner", "formats": ["xml", "net"], "approvalState": "unapproved", "allowedRuntimeUse": false},
    {"id": "long-acting-antipsychotics", "path": "BNs/10 - Long Acting Antipsychotic Medications", "sourceStatus": "model-development-source", "canonicalOwner": "clinical-model-owner", "formats": ["xml", "net"], "approvalState": "unapproved", "allowedRuntimeUse": false},
    {"id": "acute-dystonia", "path": "BNs/11 - Acute Dystonia & anticholinergic therapy", "sourceStatus": "model-development-source", "canonicalOwner": "clinical-model-owner", "formats": ["xml", "net"], "approvalState": "unapproved", "allowedRuntimeUse": false},
    {"id": "parkinsonism", "path": "BNs/12 - Treatments for Parkinsonism", "sourceStatus": "model-development-source", "canonicalOwner": "clinical-model-owner", "formats": ["xml", "net"], "approvalState": "unapproved", "allowedRuntimeUse": false},
    {"id": "akathisia", "path": "BNs/13 - Treatments for Akathesia", "sourceStatus": "model-development-source", "canonicalOwner": "clinical-model-owner", "formats": ["xml", "net"], "approvalState": "unapproved", "allowedRuntimeUse": false},
    {"id": "tardive-dyskinesia", "path": "BNs/14 - VMAT2 Medications for Tardive Dyskinesia", "sourceStatus": "model-development-source", "canonicalOwner": "clinical-model-owner", "formats": ["xml", "net"], "approvalState": "unapproved", "allowedRuntimeUse": false},
    {"id": "clozapine-suicide-risk", "path": "BNs/Clozapine in Suicide Risk", "sourceStatus": "model-development-source", "canonicalOwner": "clinical-model-owner", "formats": ["xml"], "approvalState": "unapproved", "allowedRuntimeUse": false},
    {"id": "involuntary-treatment", "path": "BNs/Involuntary-Treatment-Considerations", "sourceStatus": "model-development-source", "canonicalOwner": "clinical-model-owner", "formats": ["xml"], "approvalState": "unapproved", "allowedRuntimeUse": false},
    {"id": "pharmacotherapy", "path": "BNs/Pharmacotherapy", "sourceStatus": "model-development-source", "canonicalOwner": "clinical-model-owner", "formats": ["xml"], "approvalState": "unapproved", "allowedRuntimeUse": false},
    {"id": "treatment-setting", "path": "BNs/Treatment-Setting", "sourceStatus": "model-development-source", "canonicalOwner": "clinical-model-owner", "formats": ["xml"], "approvalState": "unapproved", "allowedRuntimeUse": false}
  ],
  "artifacts": [
    {"id": "source.continuing-medications.xml", "path": "BNs/5 - Continuing Medications/gemini-code-1783421787562.xml", "location": "source", "topicId": "continuing-medications", "sourceStatus": "model-development-source", "canonicalOwner": "clinical-model-owner", "format": "xml", "sha256": "3f7027f075c79e2452294f31f339bde784fe46bd5af323a5c9b81f2753519edd", "approvalState": "unapproved", "allowedRuntimeUse": false, "stableId": null},
    {"id": "source.continuing-medications.net", "path": "BNs/5 - Continuing Medications/network.net", "location": "source", "topicId": "continuing-medications", "sourceStatus": "model-development-source", "canonicalOwner": "clinical-model-owner", "format": "net", "sha256": "2fb7099f442e8f3766f8870c91df572b15c4f14665053851c232ed6e9c7ba976", "approvalState": "unapproved", "allowedRuntimeUse": false, "stableId": null},
    {"id": "source.continuing-same.xml", "path": "BNs/6 - Continuing the Same Medication/gemini-code-1783439886327.xml", "location": "source", "topicId": "continuing-same-medication", "sourceStatus": "model-development-source", "canonicalOwner": "clinical-model-owner", "format": "xml", "sha256": "751bdd8c082c68befa3e91c8edc345586b3833d44721665e0c5456c8135f1b86", "approvalState": "unapproved", "allowedRuntimeUse": false, "stableId": null},
    {"id": "source.continuing-same.net", "path": "BNs/6 - Continuing the Same Medication/statement_6_bn.net", "location": "source", "topicId": "continuing-same-medication", "sourceStatus": "model-development-source", "canonicalOwner": "clinical-model-owner", "format": "net", "sha256": "a10ec122dba6e687be5edebe75c3144ccf1e49d33af41f5506a131ee4e036cf0", "approvalState": "unapproved", "allowedRuntimeUse": false, "stableId": null},
    {"id": "source.clozapine-trs.xml", "path": "BNs/7 - Clozapine in Treatment-Resistant Schizophrenia/gemini-code-1783422447172.xml", "location": "source", "topicId": "clozapine-treatment-resistant", "sourceStatus": "model-development-source", "canonicalOwner": "clinical-model-owner", "format": "xml", "sha256": "e3c82b480b761cdbb66e969d91834cf9db6c3feaf43771efac15e61a7963c12c", "approvalState": "unapproved", "allowedRuntimeUse": false, "stableId": null},
    {"id": "source.clozapine-trs.net", "path": "BNs/7 - Clozapine in Treatment-Resistant Schizophrenia/clozapine_trs.net", "location": "source", "topicId": "clozapine-treatment-resistant", "sourceStatus": "model-development-source", "canonicalOwner": "clinical-model-owner", "format": "net", "sha256": "bc2708fb684802136d9bd4b269cba1f5e35b74a5f5639711a13fe2f597606755", "approvalState": "unapproved", "allowedRuntimeUse": false, "stableId": null},
    {"id": "source.clozapine-aggression.xml", "path": "BNs/9 - Clozapine in Aggressive Behavior _/gemini-code-1783422744909.xml", "location": "source", "topicId": "clozapine-aggressive-behavior", "sourceStatus": "model-development-source", "canonicalOwner": "clinical-model-owner", "format": "xml", "sha256": "424562a955ef0def89e93f8fede10e87b7bd65b6b9e95182634baecfa1786416", "approvalState": "unapproved", "allowedRuntimeUse": false, "stableId": null},
    {"id": "source.clozapine-aggression.net", "path": "BNs/9 - Clozapine in Aggressive Behavior _/clozapine_aggressive_behavior.net", "location": "source", "topicId": "clozapine-aggressive-behavior", "sourceStatus": "model-development-source", "canonicalOwner": "clinical-model-owner", "format": "net", "sha256": "06549887c4ea63dd5ea49705adbe77956eee0cdb768389b1a74006994161ed59", "approvalState": "unapproved", "allowedRuntimeUse": false, "stableId": null},
    {"id": "source.long-acting.xml", "path": "BNs/10 - Long Acting Antipsychotic Medications/gemini-code-1783423101383.xml", "location": "source", "topicId": "long-acting-antipsychotics", "sourceStatus": "model-development-source", "canonicalOwner": "clinical-model-owner", "format": "xml", "sha256": "e86aec1c094b7c0fc33be4a0dd78373807f387dc646bea3ba73e96923b1c70c5", "approvalState": "unapproved", "allowedRuntimeUse": false, "stableId": null},
    {"id": "source.long-acting.net", "path": "BNs/10 - Long Acting Antipsychotic Medications/lai_antipsychotic_bn.net", "location": "source", "topicId": "long-acting-antipsychotics", "sourceStatus": "model-development-source", "canonicalOwner": "clinical-model-owner", "format": "net", "sha256": "ed1ce8fec694b321d424c3858c6c27756c01a70c689443334e1efaac420a58ff", "approvalState": "unapproved", "allowedRuntimeUse": false, "stableId": null},
    {"id": "source.acute-dystonia.xml", "path": "BNs/11 - Acute Dystonia & anticholinergic therapy/gemini-code-1783438905589.xml", "location": "source", "topicId": "acute-dystonia", "sourceStatus": "model-development-source", "canonicalOwner": "clinical-model-owner", "format": "xml", "sha256": "22417aca1fb21c4adc33e5941255d3c7f9badec765ea417ff95a5d313ae119f0", "approvalState": "unapproved", "allowedRuntimeUse": false, "stableId": null},
    {"id": "source.acute-dystonia.net", "path": "BNs/11 - Acute Dystonia & anticholinergic therapy/acute_dystonia_anticholinergic.net", "location": "source", "topicId": "acute-dystonia", "sourceStatus": "model-development-source", "canonicalOwner": "clinical-model-owner", "format": "net", "sha256": "96d4806b91ff06ea5bca8faa6d74f00de33767f3da640b1d6594dff8c3263b84", "approvalState": "unapproved", "allowedRuntimeUse": false, "stableId": null},